{
  "id": "conversion.calculator-banner",
  "family": "mars",
  "category": "conversion",
  "retrievalEligible": true,
  "purpose": "450px image banner linking to the build-vs-buy calculator.",
  "generatedAssetRoles": [
    "asset.user-supplied",
    "illustration.generated",
    "texture.dither-field"
  ],
  "variants": {
    "default": "/rius/pricing"
  },
  "implementedBy": [
    {
      "path": "src/pages/RiusPricing.jsx",
      "lines": "175-195",
      "quote": "function CalculatorBanner()"
    }
  ],
  "source": {
    "id": "src:CalculatorBanner@src/pages/RiusPricing.jsx:175-195",
    "tag": "CalculatorBanner",
    "file": "src/pages/RiusPricing.jsx",
    "lines": "175-195"
  },
  "semantic": {
    "id": "conversion.calculator-banner",
    "category": "conversion"
  },
  "content": {
    "type": "object",
    "properties": {
      "title": {
        "type": "string",
        "minLength": 1,
        "maxWords": 10
      },
      "sub": {
        "type": "string",
        "minLength": 1,
        "maxWords": 25
      },
      "cta": {
        "type": "object",
        "properties": {
          "label": {
            "type": "string",
            "minLength": 1,
            "maxWords": 4
          },
          "href": {
            "type": "string",
            "minLength": 1,
            "x-linkField": true,
            "description": "internal path (/..., #...) or https URL on an allowed outbound domain (policies/link-kinds.json)"
          }
        },
        "additionalProperties": false,
        "required": [
          "label",
          "href"
        ]
      },
      "background": {
        "type": "object",
        "properties": {
          "assetRole": {
            "enum": [
              "texture.dither-field",
              "scene.mars-figurative",
              "illustration.generated",
              "asset.user-supplied"
            ]
          },
          "ref": {
            "type": "string",
            "pattern": "^(/assets/[A-Za-z0-9_./-]+|generate:.{8,200}|placeholder:[a-z0-9][a-z0-9-]{2,59}|user-supplied:[a-z0-9][a-z0-9-]{2,59})$",
            "description": "clone mode: an existing clone asset path, or generate:<brief> only for roles whose cloneModePolicy is may-generate-new. generation mode: generate:<brief> | placeholder:<id> | user-supplied:<id> on a generation-safe role only (never /assets/)."
          },
          "alt": {
            "type": "string",
            "maxWords": 14
          }
        },
        "additionalProperties": false,
        "required": [
          "assetRole",
          "ref",
          "alt"
        ]
      }
    },
    "additionalProperties": false,
    "required": [
      "title",
      "sub",
      "cta",
      "background"
    ]
  },
  "constraints": {},
  "motion": {
    "allowedPatterns": [
      "amber-button-hover"
    ],
    "reducedMotionFallback": "transitions-disabled"
  },
  "responsive": {
    "390": {
      "height": 450,
      "text": "max 326, gap 24"
    },
    "810": {
      "height": 610,
      "text": "max 420, gap 38"
    },
    "1200": {
      "height": 450,
      "text": "max 990"
    },
    "evidence": [
      {
        "path": "src/pages/RiusPricing.jsx",
        "lines": "180",
        "quote": "relative flex h-[450px] items-center justify-center overflow-hidden px-8 md:h-[610px] lg:h-[450px]"
      },
      {
        "path": "src/pages/RiusPricing.jsx",
        "lines": "182",
        "quote": "max-w-[326px] flex-col items-center gap-6 text-center md:max-w-[420px]"
      }
    ]
  }
}
