{
  "id": "blog.title-block",
  "family": "mars",
  "category": "hero",
  "retrievalEligible": true,
  "purpose": "Blog title block: chip, 56px H1, lead over dithered title texture.",
  "generatedAssetRoles": [
    "asset.user-supplied",
    "texture.dither-field"
  ],
  "variants": {
    "default": "/blog"
  },
  "implementedBy": [
    {
      "path": "src/pages/BlogIndex.jsx",
      "lines": "11-26",
      "quote": "function TitleBlock()"
    }
  ],
  "source": {
    "id": "src:TitleBlock@src/pages/BlogIndex.jsx:11-26",
    "tag": "TitleBlock",
    "file": "src/pages/BlogIndex.jsx",
    "lines": "11-26"
  },
  "semantic": {
    "id": "blog.title-block",
    "category": "hero"
  },
  "content": {
    "type": "object",
    "properties": {
      "chip": {
        "type": "string",
        "minLength": 1,
        "maxWords": 1
      },
      "title": {
        "type": "string",
        "minLength": 1,
        "maxWords": 6
      },
      "lead": {
        "type": "string",
        "minLength": 1,
        "maxWords": 25
      },
      "background": {
        "type": "object",
        "properties": {
          "assetRole": {
            "enum": [
              "texture.dither-field",
              "asset.user-supplied"
            ]
          },
          "ref": {
            "type": "string",
            "pattern": "^(/assets/[A-Za-z0-9_./-]+|generate:.{8,200}|placeholder:[a-z0-9][a-z0-9-]{2,59}|user-supplied:[a-z0-9][a-z0-9-]{2,59})$",
            "description": "clone mode: an existing clone asset path, or generate:<brief> only for roles whose cloneModePolicy is may-generate-new. generation mode: generate:<brief> | placeholder:<id> | user-supplied:<id> on a generation-safe role only (never /assets/)."
          },
          "alt": {
            "type": "string",
            "maxWords": 14
          }
        },
        "additionalProperties": false,
        "required": [
          "assetRole",
          "ref",
          "alt"
        ]
      }
    },
    "additionalProperties": false,
    "required": [
      "chip",
      "title",
      "lead",
      "background"
    ]
  },
  "constraints": {
    "onePerPage": true
  },
  "motion": {
    "allowedPatterns": [],
    "reducedMotionFallback": "none-needed"
  },
  "responsive": {
    "390": {
      "pad": "64/24"
    },
    "810": {
      "pad": "64/24"
    },
    "1200": {
      "height": 310
    },
    "evidence": [
      {
        "path": "src/pages/BlogIndex.jsx",
        "lines": "14",
        "quote": "lg:h-[310px] lg:px-0"
      }
    ]
  }
}
