{
  "id": "alt.faq",
  "family": "mars",
  "category": "faq",
  "retrievalEligible": true,
  "purpose": "FAQ as native <details>, one open at a time across the page.",
  "generatedAssetRoles": [],
  "variants": {
    "arize": "arize data",
    "langfuse": "langfuse data"
  },
  "implementedBy": [
    {
      "path": "src/pages/Alternatives.jsx",
      "lines": "1034-1040",
      "quote": "function FaqBlock({ items, acc })"
    }
  ],
  "source": {
    "id": "src:FaqBlock@src/pages/Alternatives.jsx:1034-1040",
    "tag": "FaqBlock",
    "file": "src/pages/Alternatives.jsx",
    "lines": "1034-1040"
  },
  "semantic": {
    "id": "alt.faq",
    "category": "faq"
  },
  "content": {
    "type": "object",
    "properties": {
      "items": {
        "type": "array",
        "items": {
          "type": "object",
          "properties": {
            "question": {
              "type": "string",
              "minLength": 1,
              "maxWords": 16
            },
            "answer": {
              "type": "string",
              "minLength": 1,
              "maxWords": 60
            }
          },
          "additionalProperties": false,
          "required": [
            "question",
            "answer"
          ]
        },
        "minItems": 2,
        "maxItems": 10
      }
    },
    "additionalProperties": false,
    "required": [
      "items"
    ]
  },
  "constraints": {},
  "motion": {
    "allowedPatterns": [],
    "reducedMotionFallback": "none-needed"
  },
  "responsive": {
    "390": {
      "frame": "fixed 420px box centred on the viewport and clipped (overflow-x-clip)",
      "sectionPad": 16
    },
    "810": {
      "frame": "fixed 918px box, centred, clipped",
      "sectionPad": 64
    },
    "1200": {
      "frame": "fixed 1200px (arize) / 1234px (langfuse) box, centred",
      "sectionPad": 64
    },
    "evidence": [
      {
        "path": "src/pages/Alternatives.jsx",
        "lines": "295",
        "quote": "px-4 md:px-16"
      },
      {
        "path": "src/pages/Alternatives.jsx",
        "lines": "77",
        "quote": "width: 'w-[420px] ml-[calc(50%-210px)] md:w-[918px] md:ml-[calc(50%-459px)] lg:w-[1200px]"
      },
      {
        "path": "src/pages/Alternatives.jsx",
        "lines": "1063",
        "quote": "<div className={`overflow-x-clip ${d.frame}`}>"
      }
    ]
  },
  "notes": "Native rebuild of the live iframe template, typeset in font-display (Inter Display) 16/22.4 with Geist Mono labels; the iframe CSS/script quoted in specs/products.md appendices is deliberately NOT copied here."
}
