{
  "id": "product.feature-split",
  "family": "mars",
  "category": "product",
  "retrievalEligible": true,
  "purpose": "Home product split: titled panel with badge/H2/body/actions beside a 671px product screenshot.",
  "generatedAssetRoles": [
    "asset.user-supplied",
    "screenshot.placeholder"
  ],
  "variants": {
    "tares-text-left": "copy left, image right",
    "rius-image-left": "image left, copy right"
  },
  "implementedBy": [
    {
      "path": "src/components/Product.jsx",
      "lines": "36-71",
      "quote": "export function Tares()"
    },
    {
      "path": "src/components/Product.jsx",
      "lines": "73-113",
      "quote": "export function Rius()"
    }
  ],
  "source": {
    "id": "src:Tares@src/components/Product.jsx:36-71",
    "tag": "Tares",
    "file": "src/components/Product.jsx",
    "lines": "36-71"
  },
  "semantic": {
    "id": "product.feature-split",
    "category": "product"
  },
  "content": {
    "type": "object",
    "properties": {
      "badge": {
        "type": "string",
        "minLength": 1,
        "maxWords": 3
      },
      "title": {
        "type": "string",
        "minLength": 1,
        "maxWords": 12
      },
      "body": {
        "type": "array",
        "items": {
          "type": "string",
          "minLength": 1,
          "maxWords": 50
        },
        "minItems": 1,
        "maxItems": 4
      },
      "actions": {
        "type": "array",
        "items": {
          "type": "object",
          "properties": {
            "label": {
              "type": "string",
              "minLength": 1,
              "maxWords": 3
            },
            "href": {
              "type": "string",
              "minLength": 1,
              "x-linkField": true,
              "description": "internal path (/..., #...) or https URL on an allowed outbound domain (policies/link-kinds.json)"
            }
          },
          "additionalProperties": false,
          "required": [
            "label",
            "href"
          ]
        },
        "minItems": 1,
        "maxItems": 2
      },
      "screenshot": {
        "type": "object",
        "properties": {
          "assetRole": {
            "enum": [
              "product.screenshot",
              "screenshot.placeholder",
              "asset.user-supplied"
            ]
          },
          "ref": {
            "type": "string",
            "pattern": "^(/assets/[A-Za-z0-9_./-]+|generate:.{8,200}|placeholder:[a-z0-9][a-z0-9-]{2,59}|user-supplied:[a-z0-9][a-z0-9-]{2,59})$",
            "description": "clone mode: an existing clone asset path, or generate:<brief> only for roles whose cloneModePolicy is may-generate-new. generation mode: generate:<brief> | placeholder:<id> | user-supplied:<id> on a generation-safe role only (never /assets/)."
          },
          "alt": {
            "type": "string",
            "maxWords": 14
          }
        },
        "additionalProperties": false,
        "required": [
          "assetRole",
          "ref",
          "alt"
        ]
      }
    },
    "additionalProperties": false,
    "required": [
      "badge",
      "title",
      "body",
      "actions",
      "screenshot"
    ]
  },
  "constraints": {},
  "motion": {
    "allowedPatterns": [],
    "reducedMotionFallback": "none-needed"
  },
  "responsive": {
    "390": {
      "order": "image first, then copy",
      "image": "400 tall"
    },
    "810": {
      "order": "copy first, then image",
      "image": "671 tall"
    },
    "1200": {
      "columns": 2,
      "copyPanel": "671 tall, 64px pad"
    },
    "evidence": [
      {
        "path": "src/components/Product.jsx",
        "lines": "41",
        "quote": "{/* mobile: image first; tablet: text first; desktop: text left */}"
      },
      {
        "path": "src/components/Product.jsx",
        "lines": "31",
        "quote": "block h-[400px] w-full object-cover md:h-[671px]"
      }
    ]
  }
}
