{
  "id": "pricing.plan-cards",
  "family": "mars",
  "category": "pricing",
  "retrievalEligible": true,
  "purpose": "Four flush Rius plan cards.",
  "generatedAssetRoles": [
    "asset.user-supplied",
    "icon.pixel"
  ],
  "variants": {
    "default": "/rius"
  },
  "implementedBy": [
    {
      "path": "src/components/PlanCards.jsx",
      "lines": "6-47",
      "quote": "export default function PlanCards"
    }
  ],
  "source": {
    "id": "src:PlanCards@src/components/PlanCards.jsx:6-47",
    "tag": "PlanCards",
    "file": "src/components/PlanCards.jsx",
    "lines": "6-47"
  },
  "semantic": {
    "id": "pricing.plan-cards",
    "category": "pricing"
  },
  "content": {
    "type": "object",
    "properties": {
      "plans": {
        "type": "array",
        "items": {
          "type": "object",
          "properties": {
            "name": {
              "type": "string",
              "minLength": 1,
              "maxWords": 2
            },
            "price": {
              "type": "string",
              "minLength": 1,
              "maxWords": 2
            },
            "description": {
              "type": "string",
              "minLength": 1,
              "maxWords": 22
            },
            "promo": {
              "type": "string",
              "minLength": 1,
              "maxWords": 6
            },
            "cta": {
              "type": "object",
              "properties": {
                "label": {
                  "type": "string",
                  "minLength": 1,
                  "maxWords": 4
                },
                "href": {
                  "type": "string",
                  "minLength": 1,
                  "x-linkField": true,
                  "description": "internal path (/..., #...) or https URL on an allowed outbound domain (policies/link-kinds.json)"
                }
              },
              "additionalProperties": false,
              "required": [
                "label",
                "href"
              ]
            },
            "highlight": {
              "type": "boolean"
            },
            "icon": {
              "type": "object",
              "properties": {
                "assetRole": {
                  "enum": [
                    "icon.pixel",
                    "asset.user-supplied"
                  ]
                },
                "ref": {
                  "type": "string",
                  "pattern": "^(/assets/[A-Za-z0-9_./-]+|generate:.{8,200}|placeholder:[a-z0-9][a-z0-9-]{2,59}|user-supplied:[a-z0-9][a-z0-9-]{2,59})$",
                  "description": "clone mode: an existing clone asset path, or generate:<brief> only for roles whose cloneModePolicy is may-generate-new. generation mode: generate:<brief> | placeholder:<id> | user-supplied:<id> on a generation-safe role only (never /assets/)."
                },
                "alt": {
                  "type": "string",
                  "maxWords": 14
                }
              },
              "additionalProperties": false,
              "required": [
                "assetRole",
                "ref",
                "alt"
              ]
            },
            "specs": {
              "type": "array",
              "items": {
                "type": "object",
                "properties": {
                  "label": {
                    "type": "string",
                    "minLength": 1,
                    "maxWords": 4
                  },
                  "value": {
                    "type": "string",
                    "minLength": 1,
                    "maxWords": 3
                  }
                },
                "additionalProperties": false,
                "required": [
                  "label",
                  "value"
                ]
              },
              "minItems": 1,
              "maxItems": 8
            }
          },
          "additionalProperties": false,
          "required": [
            "name",
            "price",
            "description",
            "cta",
            "highlight",
            "icon",
            "specs"
          ]
        },
        "minItems": 4,
        "maxItems": 4
      }
    },
    "additionalProperties": false,
    "required": [
      "plans"
    ]
  },
  "constraints": {},
  "motion": {
    "allowedPatterns": [],
    "reducedMotionFallback": "none-needed"
  },
  "responsive": {
    "390": {
      "columns": 1
    },
    "810": {
      "columns": "2x2, equal rows (552)"
    },
    "1200": {
      "columns": 4
    },
    "evidence": [
      {
        "path": "src/components/PlanCards.jsx",
        "lines": "9",
        "quote": "grid grid-cols-1 md:grid-cols-2 md:auto-rows-fr lg:grid-cols-4"
      },
      {
        "path": "src/components/PlanCards.jsx",
        "lines": "16",
        "quote": "md:min-h-[243.5px]"
      }
    ]
  }
}
