{
  "id": "conversion.cta-xs",
  "family": "mars",
  "category": "conversion",
  "retrievalEligible": true,
  "purpose": "Small image banner linking to the plans page ('Explore the Rius plans').",
  "generatedAssetRoles": [
    "asset.user-supplied",
    "texture.dither-field"
  ],
  "variants": {
    "default": "/rius"
  },
  "implementedBy": [
    {
      "path": "src/pages/Rius.jsx",
      "lines": "258-272",
      "quote": "function CtaXs()"
    }
  ],
  "source": {
    "id": "src:CtaXs@src/pages/Rius.jsx:258-272",
    "tag": "CtaXs",
    "file": "src/pages/Rius.jsx",
    "lines": "258-272"
  },
  "semantic": {
    "id": "conversion.cta-xs",
    "category": "conversion"
  },
  "content": {
    "type": "object",
    "properties": {
      "label": {
        "type": "string",
        "minLength": 1,
        "maxWords": 5
      },
      "href": {
        "type": "string",
        "minLength": 1,
        "x-linkField": true,
        "description": "internal path (/..., #...) or https URL on an allowed outbound domain (policies/link-kinds.json)"
      },
      "background": {
        "type": "object",
        "properties": {
          "assetRole": {
            "enum": [
              "texture.dither-field",
              "asset.user-supplied"
            ]
          },
          "ref": {
            "type": "string",
            "pattern": "^(/assets/[A-Za-z0-9_./-]+|generate:.{8,200}|placeholder:[a-z0-9][a-z0-9-]{2,59}|user-supplied:[a-z0-9][a-z0-9-]{2,59})$",
            "description": "clone mode: an existing clone asset path, or generate:<brief> only for roles whose cloneModePolicy is may-generate-new. generation mode: generate:<brief> | placeholder:<id> | user-supplied:<id> on a generation-safe role only (never /assets/)."
          },
          "alt": {
            "type": "string",
            "maxWords": 14
          }
        },
        "additionalProperties": false,
        "required": [
          "assetRole",
          "ref",
          "alt"
        ]
      }
    },
    "additionalProperties": false,
    "required": [
      "label",
      "href",
      "background"
    ]
  },
  "constraints": {},
  "motion": {
    "allowedPatterns": [],
    "reducedMotionFallback": "none-needed"
  },
  "responsive": {
    "390": {
      "height": 200,
      "layout": "column, icon top / label bottom"
    },
    "810": {
      "height": "auto (64px vertical pad)",
      "layout": "row, gap 24"
    },
    "1200": {
      "height": 104,
      "inset": "128px"
    },
    "evidence": [
      {
        "path": "src/pages/Rius.jsx",
        "lines": "261",
        "quote": "relative flex h-[200px] flex-col justify-between overflow-hidden p-8 md:h-auto md:flex-row"
      }
    ]
  }
}
