{
  "id": "content.article-summary-body",
  "family": "mars",
  "category": "content",
  "retrievalEligible": true,
  "purpose": "Long-form body rendered SUMMARY-ONLY: headings + one-line summaries + 'Read the full article on glassflow.ai'.",
  "generatedAssetRoles": [],
  "variants": {
    "post": "/blog/:slug"
  },
  "implementedBy": [
    {
      "path": "src/pages/BlogPost.jsx",
      "lines": "2",
      "quote": "// Bodies are rendered from the spec outline"
    },
    {
      "path": "src/pages/BlogPost.jsx",
      "lines": "20-37",
      "quote": "function bodyFor(post)"
    },
    {
      "path": "src/components/ArticleBody.jsx",
      "lines": "154-161",
      "quote": "export default function ArticleBody"
    }
  ],
  "source": {
    "id": "src:bodyFor@src/pages/BlogPost.jsx:20-37",
    "tag": "bodyFor",
    "file": "src/pages/BlogPost.jsx",
    "lines": "20-37"
  },
  "semantic": {
    "id": "content.article-summary-body",
    "category": "content"
  },
  "content": {
    "type": "object",
    "properties": {
      "contentPolicy": {
        "const": "summary-only"
      },
      "lede": {
        "type": "string",
        "minLength": 1,
        "maxWords": 30,
        "description": "one-sentence summary, not the original opening paragraph"
      },
      "outline": {
        "type": "array",
        "items": {
          "type": "object",
          "properties": {
            "level": {
              "enum": [
                "h2",
                "h3"
              ]
            },
            "heading": {
              "type": "string",
              "minLength": 1,
              "maxWords": 16
            },
            "summary": {
              "type": "string",
              "minLength": 1,
              "maxWords": 30,
              "description": "one-line summary written fresh; never a copied paragraph"
            }
          },
          "additionalProperties": false,
          "required": [
            "level",
            "heading"
          ]
        },
        "minItems": 1,
        "maxItems": 40
      },
      "fullTextLink": {
        "type": "object",
        "properties": {
          "label": {
            "type": "string",
            "pattern": "^Read the full article on (glassflow\\.ai|[a-z0-9-]+\\.(example|invalid))$",
            "maxWords": 8
          },
          "href": {
            "type": "string",
            "pattern": "^https://(www\\.glassflow\\.ai|[a-z0-9-]+\\.(example|invalid))/",
            "x-linkField": true
          }
        },
        "additionalProperties": false,
        "required": [
          "label",
          "href"
        ]
      }
    },
    "additionalProperties": false,
    "required": [
      "contentPolicy",
      "outline",
      "fullTextLink"
    ]
  },
  "constraints": {},
  "motion": {
    "allowedPatterns": [],
    "reducedMotionFallback": "none-needed"
  },
  "responsive": {
    "390": {
      "column": "full width minus padding"
    },
    "810": {
      "column": "centred"
    },
    "1200": {
      "column": "716 centred"
    },
    "evidence": [
      {
        "path": "src/components/ArticleBody.jsx",
        "lines": "154-161",
        "quote": "export default function ArticleBody"
      }
    ]
  },
  "policies": [
    "long-form-summary-only"
  ]
}
