{
  "id": "feature.what-you-get",
  "family": "mars",
  "category": "feature",
  "retrievalEligible": true,
  "purpose": "Heading + intro row, then 2-column feature cards (title bar, image, text, read more).",
  "generatedAssetRoles": [
    "asset.user-supplied",
    "screenshot.placeholder"
  ],
  "variants": {
    "default": "/rius"
  },
  "implementedBy": [
    {
      "path": "src/pages/Rius.jsx",
      "lines": "228-258",
      "quote": "function WhatYouGet()"
    }
  ],
  "source": {
    "id": "src:WhatYouGet@src/pages/Rius.jsx:228-258",
    "tag": "WhatYouGet",
    "file": "src/pages/Rius.jsx",
    "lines": "228-258"
  },
  "semantic": {
    "id": "feature.what-you-get",
    "category": "feature"
  },
  "content": {
    "type": "object",
    "properties": {
      "heading": {
        "type": "string",
        "minLength": 1,
        "maxWords": 4
      },
      "intro": {
        "type": "string",
        "minLength": 1,
        "maxWords": 25
      },
      "features": {
        "type": "array",
        "items": {
          "type": "object",
          "properties": {
            "title": {
              "type": "string",
              "minLength": 1,
              "maxWords": 5
            },
            "text": {
              "type": "string",
              "minLength": 1,
              "maxWords": 20
            },
            "image": {
              "type": "object",
              "properties": {
                "assetRole": {
                  "enum": [
                    "product.screenshot",
                    "screenshot.placeholder",
                    "asset.user-supplied"
                  ]
                },
                "ref": {
                  "type": "string",
                  "pattern": "^(/assets/[A-Za-z0-9_./-]+|generate:.{8,200}|placeholder:[a-z0-9][a-z0-9-]{2,59}|user-supplied:[a-z0-9][a-z0-9-]{2,59})$",
                  "description": "clone mode: an existing clone asset path, or generate:<brief> only for roles whose cloneModePolicy is may-generate-new. generation mode: generate:<brief> | placeholder:<id> | user-supplied:<id> on a generation-safe role only (never /assets/)."
                },
                "alt": {
                  "type": "string",
                  "maxWords": 14
                }
              },
              "additionalProperties": false,
              "required": [
                "assetRole",
                "ref",
                "alt"
              ]
            },
            "link": {
              "type": "object",
              "properties": {
                "label": {
                  "type": "string",
                  "minLength": 1,
                  "maxWords": 3
                },
                "href": {
                  "type": "string",
                  "minLength": 1,
                  "x-linkField": true,
                  "description": "internal path (/..., #...) or https URL on an allowed outbound domain (policies/link-kinds.json)"
                }
              },
              "additionalProperties": false,
              "required": [
                "label",
                "href"
              ]
            }
          },
          "additionalProperties": false,
          "required": [
            "title",
            "text",
            "image",
            "link"
          ]
        },
        "minItems": 2,
        "maxItems": 6
      }
    },
    "additionalProperties": false,
    "required": [
      "heading",
      "intro",
      "features"
    ]
  },
  "constraints": {},
  "motion": {
    "allowedPatterns": [],
    "reducedMotionFallback": "none-needed"
  },
  "responsive": {
    "390": {
      "cards": 1,
      "headingRow": "stacked"
    },
    "810": {
      "cards": "2, equal rows, card text 13px",
      "headingRow": "row, two equal halves"
    },
    "1200": {
      "cards": 2,
      "headingRow": "178 tall, 656 + 600"
    },
    "evidence": [
      {
        "path": "src/pages/Rius.jsx",
        "lines": "238",
        "quote": "grid grid-cols-1 gap-2 md:grid-cols-2 md:auto-rows-fr md:items-start"
      },
      {
        "path": "src/pages/Rius.jsx",
        "lines": "231",
        "quote": "md:flex-row md:items-center lg:h-[178px]"
      }
    ]
  }
}
