{
  "id": "blog.post-grid",
  "family": "mars",
  "category": "content",
  "retrievalEligible": true,
  "purpose": "All posts as cards, no pagination.",
  "generatedAssetRoles": [
    "asset.user-supplied",
    "illustration.generated"
  ],
  "variants": {
    "default": "/blog"
  },
  "implementedBy": [
    {
      "path": "src/pages/BlogIndex.jsx",
      "lines": "123-127",
      "quote": "<Shell inner=\"grid grid-cols-1 p-3 md:grid-cols-2 md:gap-2 lg:grid-cols-3\">"
    }
  ],
  "source": {
    "id": "src:Shell@src/pages/BlogIndex.jsx:123-127",
    "tag": "Shell",
    "file": "src/pages/BlogIndex.jsx",
    "lines": "123-127"
  },
  "semantic": {
    "id": "blog.post-grid",
    "category": "content"
  },
  "content": {
    "type": "object",
    "properties": {
      "cards": {
        "type": "array",
        "items": {
          "type": "object",
          "properties": {
            "href": {
              "type": "string",
              "minLength": 1,
              "x-linkField": true,
              "description": "internal path (/..., #...) or https URL on an allowed outbound domain (policies/link-kinds.json)"
            },
            "tag": {
              "type": "string",
              "minLength": 1,
              "maxWords": 3
            },
            "title": {
              "type": "string",
              "minLength": 1,
              "maxWords": 20
            },
            "description": {
              "type": "string",
              "minLength": 1,
              "maxWords": 30
            },
            "author": {
              "type": "string",
              "minLength": 1,
              "maxWords": 5
            },
            "image": {
              "type": "object",
              "properties": {
                "assetRole": {
                  "enum": [
                    "blog.cover",
                    "illustration.generated",
                    "asset.user-supplied"
                  ]
                },
                "ref": {
                  "type": "string",
                  "pattern": "^(/assets/[A-Za-z0-9_./-]+|generate:.{8,200}|placeholder:[a-z0-9][a-z0-9-]{2,59}|user-supplied:[a-z0-9][a-z0-9-]{2,59})$",
                  "description": "clone mode: an existing clone asset path, or generate:<brief> only for roles whose cloneModePolicy is may-generate-new. generation mode: generate:<brief> | placeholder:<id> | user-supplied:<id> on a generation-safe role only (never /assets/)."
                },
                "alt": {
                  "type": "string",
                  "maxWords": 14
                }
              },
              "additionalProperties": false,
              "required": [
                "assetRole",
                "ref",
                "alt"
              ]
            }
          },
          "additionalProperties": false,
          "required": [
            "href",
            "tag",
            "title",
            "description",
            "author",
            "image"
          ]
        },
        "minItems": 1,
        "maxItems": 200
      }
    },
    "additionalProperties": false,
    "required": [
      "cards"
    ]
  },
  "constraints": {},
  "motion": {
    "allowedPatterns": [
      "blog-card-hover"
    ],
    "reducedMotionFallback": "transitions-disabled"
  },
  "responsive": {
    "390": {
      "columns": 1
    },
    "810": {
      "columns": 2
    },
    "1200": {
      "columns": 3
    },
    "evidence": [
      {
        "path": "src/pages/BlogIndex.jsx",
        "lines": "123",
        "quote": "grid grid-cols-1 p-3 md:grid-cols-2 md:gap-2 lg:grid-cols-3"
      }
    ]
  }
}
