{
  "id": "feature.image-card-grid",
  "family": "mars",
  "category": "feature",
  "retrievalEligible": true,
  "purpose": "Row of 300px full-bleed dithered cards with icon, mono title and appear body.",
  "generatedAssetRoles": [
    "asset.user-supplied",
    "icon.pixel",
    "illustration.generated",
    "texture.dither-field"
  ],
  "variants": {
    "cols-4": "/tares 'What teams build with it'",
    "cols-3": "/rius 'How it works'"
  },
  "implementedBy": [
    {
      "path": "src/components/ProductSections.jsx",
      "lines": "75-94",
      "quote": "export function ImageCardGrid"
    }
  ],
  "source": {
    "id": "src:ImageCardGrid@src/components/ProductSections.jsx:75-94",
    "tag": "ImageCardGrid",
    "file": "src/components/ProductSections.jsx",
    "lines": "75-94"
  },
  "semantic": {
    "id": "feature.image-card-grid",
    "category": "feature"
  },
  "content": {
    "type": "object",
    "properties": {
      "cards": {
        "type": "array",
        "items": {
          "type": "object",
          "properties": {
            "icon": {
              "type": "object",
              "properties": {
                "assetRole": {
                  "enum": [
                    "icon.pixel",
                    "asset.user-supplied"
                  ]
                },
                "ref": {
                  "type": "string",
                  "pattern": "^(/assets/[A-Za-z0-9_./-]+|generate:.{8,200}|placeholder:[a-z0-9][a-z0-9-]{2,59}|user-supplied:[a-z0-9][a-z0-9-]{2,59})$",
                  "description": "clone mode: an existing clone asset path, or generate:<brief> only for roles whose cloneModePolicy is may-generate-new. generation mode: generate:<brief> | placeholder:<id> | user-supplied:<id> on a generation-safe role only (never /assets/)."
                },
                "alt": {
                  "type": "string",
                  "maxWords": 14
                }
              },
              "additionalProperties": false,
              "required": [
                "assetRole",
                "ref",
                "alt"
              ]
            },
            "title": {
              "type": "string",
              "minLength": 1,
              "maxWords": 9
            },
            "body": {
              "type": "string",
              "minLength": 1,
              "maxWords": 30
            },
            "image": {
              "type": "object",
              "properties": {
                "assetRole": {
                  "enum": [
                    "texture.dither-field",
                    "scene.mars-figurative",
                    "illustration.generated",
                    "asset.user-supplied"
                  ]
                },
                "ref": {
                  "type": "string",
                  "pattern": "^(/assets/[A-Za-z0-9_./-]+|generate:.{8,200}|placeholder:[a-z0-9][a-z0-9-]{2,59}|user-supplied:[a-z0-9][a-z0-9-]{2,59})$",
                  "description": "clone mode: an existing clone asset path, or generate:<brief> only for roles whose cloneModePolicy is may-generate-new. generation mode: generate:<brief> | placeholder:<id> | user-supplied:<id> on a generation-safe role only (never /assets/)."
                },
                "alt": {
                  "type": "string",
                  "maxWords": 14
                }
              },
              "additionalProperties": false,
              "required": [
                "assetRole",
                "ref",
                "alt"
              ]
            }
          },
          "additionalProperties": false,
          "required": [
            "icon",
            "title",
            "body",
            "image"
          ]
        },
        "minItems": 3,
        "maxItems": 4
      }
    },
    "additionalProperties": false,
    "required": [
      "cards"
    ]
  },
  "constraints": {},
  "motion": {
    "allowedPatterns": [
      "product-appear"
    ],
    "reducedMotionFallback": "opacity-only"
  },
  "responsive": {
    "390": {
      "columns": 1
    },
    "810": {
      "cols-4": 2,
      "cols-3": 3
    },
    "1200": {
      "cols-4": 4,
      "cols-3": 3
    },
    "evidence": [
      {
        "path": "src/components/ProductSections.jsx",
        "lines": "75",
        "quote": "export function ImageCardGrid({ cards, cols = 'lg:grid-cols-4' })"
      },
      {
        "path": "src/pages/Tares.jsx",
        "lines": "169",
        "quote": "cols=\"md:grid-cols-2 lg:grid-cols-4\""
      },
      {
        "path": "src/pages/Rius.jsx",
        "lines": "311",
        "quote": "cols=\"md:grid-cols-3\""
      }
    ]
  }
}
