{
  "id": "conversion.image-cta",
  "family": "mars",
  "category": "conversion",
  "retrievalEligible": true,
  "purpose": "Closing image CTA: big title, optional body, amber BigButton + product dark button.",
  "generatedAssetRoles": [
    "asset.user-supplied",
    "illustration.generated",
    "texture.dither-field"
  ],
  "variants": {
    "product": "/tares and /rius/pricing closing band"
  },
  "implementedBy": [
    {
      "path": "src/components/ProductSections.jsx",
      "lines": "101-129",
      "quote": "export function ImageCTA"
    }
  ],
  "source": {
    "id": "src:ImageCTA@src/components/ProductSections.jsx:101-129",
    "tag": "ImageCTA",
    "file": "src/components/ProductSections.jsx",
    "lines": "101-129"
  },
  "semantic": {
    "id": "conversion.image-cta",
    "category": "conversion"
  },
  "content": {
    "type": "object",
    "properties": {
      "title": {
        "type": "string",
        "minLength": 1,
        "maxWords": 12
      },
      "body": {
        "type": "string",
        "minLength": 1,
        "maxWords": 40
      },
      "primary": {
        "type": "object",
        "properties": {
          "label": {
            "type": "string",
            "minLength": 1,
            "maxWords": 5
          },
          "href": {
            "type": "string",
            "minLength": 1,
            "x-linkField": true,
            "description": "internal path (/..., #...) or https URL on an allowed outbound domain (policies/link-kinds.json)"
          }
        },
        "additionalProperties": false,
        "required": [
          "label",
          "href"
        ]
      },
      "secondary": {
        "type": "object",
        "properties": {
          "label": {
            "type": "string",
            "minLength": 1,
            "maxWords": 5
          },
          "href": {
            "type": "string",
            "minLength": 1,
            "x-linkField": true,
            "description": "internal path (/..., #...) or https URL on an allowed outbound domain (policies/link-kinds.json)"
          }
        },
        "additionalProperties": false,
        "required": [
          "label",
          "href"
        ]
      },
      "background": {
        "type": "object",
        "properties": {
          "assetRole": {
            "enum": [
              "brand.dither-mark",
              "texture.dither-field",
              "illustration.generated",
              "asset.user-supplied"
            ]
          },
          "ref": {
            "type": "string",
            "pattern": "^(/assets/[A-Za-z0-9_./-]+|generate:.{8,200}|placeholder:[a-z0-9][a-z0-9-]{2,59}|user-supplied:[a-z0-9][a-z0-9-]{2,59})$",
            "description": "clone mode: an existing clone asset path, or generate:<brief> only for roles whose cloneModePolicy is may-generate-new. generation mode: generate:<brief> | placeholder:<id> | user-supplied:<id> on a generation-safe role only (never /assets/)."
          },
          "alt": {
            "type": "string",
            "maxWords": 14
          }
        },
        "additionalProperties": false,
        "required": [
          "assetRole",
          "ref",
          "alt"
        ]
      }
    },
    "additionalProperties": false,
    "required": [
      "title",
      "primary",
      "secondary",
      "background"
    ]
  },
  "constraints": {},
  "motion": {
    "allowedPatterns": [
      "amber-button-hover"
    ],
    "reducedMotionFallback": "transitions-disabled"
  },
  "responsive": {
    "390": {
      "buttons": "stacked",
      "title": "42/42",
      "copyToButtonsGap": 32
    },
    "810": {
      "buttons": "row",
      "title": "40/40",
      "copyToButtonsGap": 64
    },
    "1200": {
      "pad": "128px sides",
      "copyToButtonsGap": 64
    },
    "evidence": [
      {
        "path": "src/components/ProductSections.jsx",
        "lines": "122",
        "quote": "flex flex-col items-start gap-2 md:flex-row"
      },
      {
        "path": "src/pages/Tares.jsx",
        "lines": "194",
        "quote": "gapClass=\"gap-8 md:gap-16\""
      }
    ]
  }
}
