{
  "id": "case.detail-hero",
  "family": "mars",
  "category": "hero",
  "retrievalEligible": true,
  "purpose": "Case-study hero: chip back to /case-studies + 40px title over texture.",
  "generatedAssetRoles": [
    "asset.user-supplied",
    "texture.dither-field"
  ],
  "variants": {
    "default": "/case-studies/:slug"
  },
  "implementedBy": [
    {
      "path": "src/pages/CaseStudies.jsx",
      "lines": "139-159",
      "quote": "export function CaseStudy({ slug })"
    }
  ],
  "source": {
    "id": "src:CaseStudy@src/pages/CaseStudies.jsx:139-159",
    "tag": "CaseStudy",
    "file": "src/pages/CaseStudies.jsx",
    "lines": "139-159"
  },
  "semantic": {
    "id": "case.detail-hero",
    "category": "hero"
  },
  "content": {
    "type": "object",
    "properties": {
      "chip": {
        "type": "string",
        "minLength": 1,
        "maxWords": 2
      },
      "title": {
        "type": "string",
        "minLength": 1,
        "maxWords": 14
      },
      "background": {
        "type": "object",
        "properties": {
          "assetRole": {
            "enum": [
              "texture.dither-field",
              "asset.user-supplied"
            ]
          },
          "ref": {
            "type": "string",
            "pattern": "^(/assets/[A-Za-z0-9_./-]+|generate:.{8,200}|placeholder:[a-z0-9][a-z0-9-]{2,59}|user-supplied:[a-z0-9][a-z0-9-]{2,59})$",
            "description": "clone mode: an existing clone asset path, or generate:<brief> only for roles whose cloneModePolicy is may-generate-new. generation mode: generate:<brief> | placeholder:<id> | user-supplied:<id> on a generation-safe role only (never /assets/)."
          },
          "alt": {
            "type": "string",
            "maxWords": 14
          }
        },
        "additionalProperties": false,
        "required": [
          "assetRole",
          "ref",
          "alt"
        ]
      }
    },
    "additionalProperties": false,
    "required": [
      "chip",
      "title",
      "background"
    ]
  },
  "constraints": {
    "onePerPage": true
  },
  "motion": {
    "allowedPatterns": [],
    "reducedMotionFallback": "none-needed"
  },
  "responsive": {
    "390": {},
    "810": {},
    "1200": {
      "height": 280
    },
    "evidence": [
      {
        "path": "src/pages/CaseStudies.jsx",
        "lines": "152",
        "quote": "py-16 text-center lg:h-[280px]"
      }
    ]
  }
}
