{
  "id": "tool.build-vs-buy-calculator",
  "family": "mars",
  "category": "tool",
  "retrievalEligible": true,
  "purpose": "Interactive build-vs-buy cost calculator (logic is code-owned; only labels are content).",
  "generatedAssetRoles": [],
  "variants": {
    "default": "calculator"
  },
  "implementedBy": [
    {
      "path": "src/components/BuildVsBuyCalculator.jsx",
      "lines": "188-248",
      "quote": "export default function BuildVsBuyCalculator"
    },
    {
      "path": "src/components/BuildVsBuyCalculator.jsx",
      "lines": "225",
      "quote": "bg-panel font-sys text-[12px]"
    }
  ],
  "source": {
    "id": "src:BuildVsBuyCalculator@src/components/BuildVsBuyCalculator.jsx:188-248",
    "tag": "BuildVsBuyCalculator",
    "file": "src/components/BuildVsBuyCalculator.jsx",
    "lines": "188-248"
  },
  "semantic": {
    "id": "tool.build-vs-buy-calculator",
    "category": "tool"
  },
  "content": {
    "type": "object",
    "properties": {
      "title": {
        "type": "string",
        "minLength": 1,
        "maxWords": 12
      },
      "inputsHeading": {
        "const": "Inputs"
      },
      "resultsHeading": {
        "const": "Results"
      }
    },
    "additionalProperties": false,
    "required": [
      "title",
      "inputsHeading",
      "resultsHeading"
    ]
  },
  "constraints": {},
  "motion": {
    "allowedPatterns": [],
    "reducedMotionFallback": "none-needed"
  },
  "responsive": {
    "390": {
      "topBand": "none (calculator directly under the nav)",
      "gutters": 16
    },
    "810": {
      "topBand": "none",
      "gutters": 64
    },
    "1200": {
      "topBand": "66px band",
      "gutters": 64
    },
    "evidence": [
      {
        "path": "src/pages/Calculator.jsx",
        "lines": "17",
        "quote": "<Shell className=\"px-4 md:!px-16\" inner=\"bg-panel\">"
      },
      {
        "path": "src/pages/Calculator.jsx",
        "lines": "14",
        "quote": "<div className=\"hidden lg:block\">"
      }
    ]
  },
  "notes": "Render mirrors the live embed: root in the SYSTEM font (font-sys 12px), labels in sys-mono, title 34px/800; calc-* colours; radii 3/4px and a round help dot. Number formatting, table brand/subtitle fields and the short visible labels are code-owned and not part of the content contract."
}
