{
  "id": "about.values",
  "family": "mars",
  "category": "content",
  "retrievalEligible": true,
  "purpose": "Three values cards over dithered texture.",
  "generatedAssetRoles": [
    "asset.user-supplied",
    "icon.pixel",
    "texture.dither-field"
  ],
  "variants": {
    "default": "/about"
  },
  "implementedBy": [
    {
      "path": "src/pages/About.jsx",
      "lines": "129-147",
      "quote": "function Values()"
    }
  ],
  "source": {
    "id": "src:Values@src/pages/About.jsx:129-147",
    "tag": "Values",
    "file": "src/pages/About.jsx",
    "lines": "129-147"
  },
  "semantic": {
    "id": "about.values",
    "category": "content"
  },
  "content": {
    "type": "object",
    "properties": {
      "values": {
        "type": "array",
        "items": {
          "type": "object",
          "properties": {
            "icon": {
              "type": "object",
              "properties": {
                "assetRole": {
                  "enum": [
                    "icon.pixel",
                    "asset.user-supplied"
                  ]
                },
                "ref": {
                  "type": "string",
                  "pattern": "^(/assets/[A-Za-z0-9_./-]+|generate:.{8,200}|placeholder:[a-z0-9][a-z0-9-]{2,59}|user-supplied:[a-z0-9][a-z0-9-]{2,59})$",
                  "description": "clone mode: an existing clone asset path, or generate:<brief> only for roles whose cloneModePolicy is may-generate-new. generation mode: generate:<brief> | placeholder:<id> | user-supplied:<id> on a generation-safe role only (never /assets/)."
                },
                "alt": {
                  "type": "string",
                  "maxWords": 14
                }
              },
              "additionalProperties": false,
              "required": [
                "assetRole",
                "ref",
                "alt"
              ]
            },
            "title": {
              "type": "string",
              "minLength": 1,
              "maxWords": 2
            },
            "text": {
              "type": "string",
              "minLength": 1,
              "maxWords": 35
            }
          },
          "additionalProperties": false,
          "required": [
            "icon",
            "title",
            "text"
          ]
        },
        "minItems": 3,
        "maxItems": 3
      },
      "background": {
        "type": "object",
        "properties": {
          "assetRole": {
            "enum": [
              "texture.dither-field",
              "asset.user-supplied"
            ]
          },
          "ref": {
            "type": "string",
            "pattern": "^(/assets/[A-Za-z0-9_./-]+|generate:.{8,200}|placeholder:[a-z0-9][a-z0-9-]{2,59}|user-supplied:[a-z0-9][a-z0-9-]{2,59})$",
            "description": "clone mode: an existing clone asset path, or generate:<brief> only for roles whose cloneModePolicy is may-generate-new. generation mode: generate:<brief> | placeholder:<id> | user-supplied:<id> on a generation-safe role only (never /assets/)."
          },
          "alt": {
            "type": "string",
            "maxWords": 14
          }
        },
        "additionalProperties": false,
        "required": [
          "assetRole",
          "ref",
          "alt"
        ]
      }
    },
    "additionalProperties": false,
    "required": [
      "values",
      "background"
    ]
  },
  "constraints": {},
  "motion": {
    "allowedPatterns": [],
    "reducedMotionFallback": "none-needed"
  },
  "responsive": {
    "390": {
      "columns": 1,
      "card": "273 tall"
    },
    "810": {
      "columns": 1
    },
    "1200": {
      "columns": 3,
      "card": "350 tall"
    },
    "evidence": [
      {
        "path": "src/pages/About.jsx",
        "lines": "135",
        "quote": "relative flex h-[273px] flex-col items-center overflow-hidden bg-bar p-8"
      }
    ]
  }
}
